{
  "schemaVersion": "forgepilot-evaluation-manifest-v1",
  "corpusVersion": "forgepilot-phase1-quick-v2",
  "source": {
    "repository": "LinYsssss/reposage",
    "commit": "96137dd3b43e14c5e8881c99688663afd979cf4e",
    "migrationPolicy": "REWRITE_KEEP_DATA"
  },
  "cases": [
    {
      "id": "java-sql-resource-leak",
      "split": "development",
      "language": "JAVA",
      "fixture": "cases/java-sql-resource-leak",
      "fixtureLayout": "single",
      "selectionReason": "Java resource-safety positive case; exercises exact line matching and RESOURCE_LEAK aliasing.",
      "requirement": {
        "title": "审查 java sql resource leak 变更并保持代码契约",
        "background": "该 JAVA development 案例用于验证增量代码审查对 RESOURCE_LEAK 及明确非目标行为的识别边界。",
        "description": "针对 java-sql-resource-leak 的 fixture/diff，检查变更是否满足下列 AC；模型只能基于真实代码证据给出覆盖、未发现或存在风险的结论。"
      },
      "acceptanceCriteria": [
        {
          "acKey": "AC-0001",
          "text": "[RESOURCE_LEAK] 所有资源句柄、流和客户端响应都必须在成功与异常路径中正确关闭；重点核验 src/App.java 第 4-5 行。"
        },
        {
          "acKey": "AC-0002",
          "text": "非目标约束：hardcoded test database URL"
        }
      ],
      "expectedAcVerdicts": [
        {
          "acKey": "AC-0001",
          "verdict": "AT_RISK"
        },
        {
          "acKey": "AC-0002",
          "verdict": "COVERED"
        }
      ],
      "expectedFindings": [
        {
          "findingType": "CODE_QUALITY",
          "category": "RESOURCE_LEAK",
          "severity": "HIGH",
          "filePath": "src/App.java",
          "lineStart": 4,
          "lineEnd": 5
        }
      ],
      "nonFindings": [
        "hardcoded test database URL"
      ]
    },
    {
      "id": "typescript-ambiguous-null",
      "split": "development",
      "language": "TYPESCRIPT",
      "fixture": "cases/typescript-ambiguous-null",
      "fixtureLayout": "single",
      "selectionReason": "TypeScript nullability case; exercises a non-Java language and line-anchored finding.",
      "requirement": {
        "title": "审查 typescript ambiguous null 变更并保持代码契约",
        "background": "该 TYPESCRIPT development 案例用于验证增量代码审查对 NULLABILITY 及明确非目标行为的识别边界。",
        "description": "针对 typescript-ambiguous-null 的 fixture/diff，检查变更是否满足下列 AC；模型只能基于真实代码证据给出覆盖、未发现或存在风险的结论。"
      },
      "acceptanceCriteria": [
        {
          "acKey": "AC-0001",
          "text": "[NULLABILITY] 对可能为空的值必须进行显式校验或安全降级；重点核验 src/user.ts 第 3-3 行。"
        },
        {
          "acKey": "AC-0002",
          "text": "非目标约束：函数命名与 export 方式本身不许报；缺陷仅为可能为空的 user 或 name 被未校验地解引用"
        }
      ],
      "expectedAcVerdicts": [
        {
          "acKey": "AC-0001",
          "verdict": "AT_RISK"
        },
        {
          "acKey": "AC-0002",
          "verdict": "COVERED"
        }
      ],
      "expectedFindings": [
        {
          "findingType": "CODE_QUALITY",
          "category": "NULLABILITY",
          "severity": "MEDIUM",
          "filePath": "src/user.ts",
          "lineStart": 3,
          "lineEnd": 3
        }
      ],
      "nonFindings": [
        "非目标约束：函数命名与 export 方式本身不许报；缺陷仅为可能为空的 user 或 name 被未校验地解引用"
      ]
    },
    {
      "id": "java-broken-build",
      "split": "development",
      "language": "JAVA",
      "fixture": "cases/java-broken-build",
      "fixtureLayout": "single",
      "selectionReason": "Clean development case; verifies an empty Finding set is a valid completed result and that a defect-free added class is not reported.",
      "requirement": {
        "title": "审查 java clean change 变更并保持代码契约",
        "background": "该 JAVA development 案例用于验证增量代码审查对 未标注新增缺陷 及明确非目标行为的识别边界。",
        "description": "针对 java-broken-build 的 fixture/diff，检查变更是否满足下列 AC；模型只能基于真实代码证据给出覆盖、未发现或存在风险的结论。"
      },
      "acceptanceCriteria": [
        {
          "acKey": "AC-0001",
          "text": "非目标约束：该新增类是不含缺陷的纯函数，不得报告任何代码问题"
        }
      ],
      "expectedAcVerdicts": [
        {
          "acKey": "AC-0001",
          "verdict": "COVERED"
        }
      ],
      "expectedFindings": [],
      "nonFindings": [
        "非目标约束：该新增类是不含缺陷的纯函数，不得报告任何代码问题"
      ]
    },
    {
      "id": "biz-fee-rate-hardcoded",
      "split": "development",
      "language": "JAVA",
      "fixture": "cases/biz-fee-rate-hardcoded",
      "fixtureLayout": "base-head",
      "selectionReason": "Business-rule case with project knowledge and base/head layout.",
      "requirement": {
        "title": "审查 biz fee rate hardcoded 变更并保持代码契约",
        "background": "该 JAVA development 案例用于验证增量代码审查对 BUSINESS_RULE_RISK 及明确非目标行为的识别边界。",
        "description": "针对 biz-fee-rate-hardcoded 的 fixture/diff，检查变更是否满足下列 AC；模型只能基于真实代码证据给出覆盖、未发现或存在风险的结论。"
      },
      "acceptanceCriteria": [
        {
          "acKey": "AC-0001",
          "text": "[BUSINESS_RULE_RISK] 实现必须遵守该领域的金额、状态、顺序或业务规则；重点核验 src/main/java/com/acme/clearing/service/InstantSettlementService.java 第 13-26 行。"
        },
        {
          "acKey": "AC-0002",
          "text": "非目标约束：基仓 FeeCalculator 走 fee_rate_config 配置表的既有实现不许报"
        },
        {
          "acKey": "AC-0003",
          "text": "非目标约束：幂等键由调用方传入属正确设计，不许报"
        }
      ],
      "expectedAcVerdicts": [
        {
          "acKey": "AC-0001",
          "verdict": "AT_RISK"
        },
        {
          "acKey": "AC-0002",
          "verdict": "COVERED"
        },
        {
          "acKey": "AC-0003",
          "verdict": "COVERED"
        }
      ],
      "expectedFindings": [
        {
          "findingType": "REQUIREMENT",
          "category": "BUSINESS_RULE_RISK",
          "severity": "HIGH",
          "filePath": "src/main/java/com/acme/clearing/service/InstantSettlementService.java",
          "lineStart": 13,
          "lineEnd": 26,
          "categoryAliases": [
            "UNKNOWN"
          ]
        }
      ],
      "nonFindings": [
        "基仓 FeeCalculator 走 fee_rate_config 配置表的既有实现不许报",
        "幂等键由调用方传入属正确设计，不许报"
      ]
    },
    {
      "id": "biz-status-machine-bypass",
      "split": "development",
      "language": "JAVA",
      "fixture": "cases/biz-status-machine-bypass",
      "fixtureLayout": "base-head",
      "selectionReason": "Business status-transition case with a category-level alias.",
      "requirement": {
        "title": "审查 biz status machine bypass 变更并保持代码契约",
        "background": "该 JAVA development 案例用于验证增量代码审查对 BUSINESS_RULE_RISK 及明确非目标行为的识别边界。",
        "description": "针对 biz-status-machine-bypass 的 fixture/diff，检查变更是否满足下列 AC；模型只能基于真实代码证据给出覆盖、未发现或存在风险的结论。"
      },
      "acceptanceCriteria": [
        {
          "acKey": "AC-0001",
          "text": "[BUSINESS_RULE_RISK] 实现必须遵守该领域的金额、状态、顺序或业务规则；重点核验 src/main/java/com/acme/clearing/payout/service/ExpressPayoutService.java 第 20-29 行。"
        },
        {
          "acKey": "AC-0002",
          "text": "非目标约束：小额免排队的产品策略与额度上限本身不许报"
        }
      ],
      "expectedAcVerdicts": [
        {
          "acKey": "AC-0001",
          "verdict": "AT_RISK"
        },
        {
          "acKey": "AC-0002",
          "verdict": "COVERED"
        }
      ],
      "expectedFindings": [
        {
          "findingType": "REQUIREMENT",
          "category": "BUSINESS_RULE_RISK",
          "severity": "HIGH",
          "filePath": "src/main/java/com/acme/clearing/payout/service/ExpressPayoutService.java",
          "lineStart": 20,
          "lineEnd": 29,
          "categoryAliases": [
            "TRANSACTION_RISK",
            "UNKNOWN"
          ]
        }
      ],
      "nonFindings": [
        "小额免排队的产品策略与额度上限本身不许报"
      ]
    },
    {
      "id": "eng-contract-drift-dual-encode",
      "split": "development",
      "language": "JAVA",
      "fixture": "cases/eng-contract-drift-dual-encode",
      "fixtureLayout": "base-head",
      "selectionReason": "Engineering contract case with compatibility context and a range finding.",
      "requirement": {
        "title": "审查 eng contract drift dual encode 变更并保持代码契约",
        "background": "该 JAVA development 案例用于验证增量代码审查对 CONTRACT_DRIFT 及明确非目标行为的识别边界。",
        "description": "针对 eng-contract-drift-dual-encode 的 fixture/diff，检查变更是否满足下列 AC；模型只能基于真实代码证据给出覆盖、未发现或存在风险的结论。"
      },
      "acceptanceCriteria": [
        {
          "acKey": "AC-0001",
          "text": "[CONTRACT_DRIFT] 所有生产与消费路径必须保持同一数据契约和兼容边界；重点核验 src/main/java/com/acme/report/ReportLinkRenderer.java 第 8-10 行。"
        },
        {
          "acKey": "AC-0002",
          "text": "非目标约束：the legacy bucket:objectKey decode fallback in AssetReferenceCodec is deliberate backward compatibility and must not be reported"
        }
      ],
      "expectedAcVerdicts": [
        {
          "acKey": "AC-0001",
          "verdict": "AT_RISK"
        },
        {
          "acKey": "AC-0002",
          "verdict": "COVERED"
        }
      ],
      "expectedFindings": [
        {
          "findingType": "CODE_QUALITY",
          "category": "CONTRACT_DRIFT",
          "severity": "HIGH",
          "filePath": "src/main/java/com/acme/report/ReportLinkRenderer.java",
          "lineStart": 8,
          "lineEnd": 10,
          "categoryAliases": [
            "BUSINESS_RULE_RISK",
            "UNKNOWN"
          ]
        }
      ],
      "nonFindings": [
        "the legacy bucket:objectKey decode fallback in AssetReferenceCodec is deliberate backward compatibility and must not be reported"
      ]
    },
    {
      "id": "eng-transactional-self-invocation",
      "split": "development",
      "language": "JAVA",
      "fixture": "cases/eng-transactional-self-invocation",
      "fixtureLayout": "base-head",
      "selectionReason": "Transactional-boundary case with a multi-line Java finding.",
      "requirement": {
        "title": "审查 eng transactional self invocation 变更并保持代码契约",
        "background": "该 JAVA development 案例用于验证增量代码审查对 TRANSACTION_RISK 及明确非目标行为的识别边界。",
        "description": "针对 eng-transactional-self-invocation 的 fixture/diff，检查变更是否满足下列 AC；模型只能基于真实代码证据给出覆盖、未发现或存在风险的结论。"
      },
      "acceptanceCriteria": [